{
  "providerID": "deepseek",
  "displayName": "DeepSeek",
  "apiBaseURL": "https://api.deepseek.com/v1/chat/completions",
  "apiStyle": "openai",
  "keychainKey": "APIKey_macOS_DeepSeek",
  "defaultModel": "deepseek-chat",
  "lastSyncedAt": "2026-10-19",
  "syncSource": "cron",
  "models": [
    {
      "name": "deepseek-v4.1-flash-1017",
      "displayName": "DeepSeek V4.1 Flash 1017",
      "status": "active",
      "addedAt": "2026-10-19",
      "inputPerMillion": 0.3,
      "outputPerMillion": 1.2,
      "pricingSource": "openrouter",
      "costTier": "medium",
      "equivalentTier": "T1-balanced",
      "capabilities": [
        "chat",
        "vision"
      ],
      "contextTokens": 1048576,
      "notes": "Auto-inserted by ModelCatalogSync 2026-10-19. Verify costTier/equivalentTier/capabilities and remove this note on first human review.",
      "discoveredVia": [
        "openrouter"
      ],
      "openrouterId": "deepseek/deepseek-v4.1-flash-1017",
      "directApiName": null
    },
    {
      "name": "deepseek-v4.1-flash",
      "displayName": "DeepSeek V4.1 Flash",
      "status": "active",
      "addedAt": "2026-09-14",
      "inputPerMillion": 0.0448,
      "outputPerMillion": 0.08,
      "pricingSource": "openrouter",
      "costTier": "medium",
      "equivalentTier": "T1-balanced",
      "capabilities": [
        "chat",
        "vision"
      ],
      "contextTokens": 1048576,
      "notes": "Auto-inserted by ModelCatalogSync 2026-09-14. Verify costTier/equivalentTier/capabilities and remove this note on first human review.",
      "discoveredVia": [
        "openrouter"
      ],
      "openrouterId": "deepseek/deepseek-v4.1-flash",
      "directApiName": null
    },
    {
      "name": "deepseek-v4.1-flash:batch",
      "displayName": "DeepSeek V4.1 Flash (batch)",
      "status": "active",
      "addedAt": "2026-09-28",
      "inputPerMillion": 0.05,
      "outputPerMillion": 0.15,
      "pricingSource": "openrouter",
      "costTier": "low",
      "equivalentTier": "T1-balanced",
      "capabilities": [
        "chat",
        "vision"
      ],
      "contextTokens": 1048576,
      "notes": "Auto-inserted by ModelCatalogSync 2026-09-28. Verify costTier/equivalentTier/capabilities and remove this note on first human review.",
      "discoveredVia": [
        "openrouter"
      ],
      "openrouterId": "deepseek/deepseek-v4.1-flash:batch",
      "directApiName": null
    },
    {
      "name": "deepseek-v4-flash-vision-exp",
      "displayName": "DeepSeek V4 Flash Vision Exp",
      "status": "active",
      "addedAt": "2026-08-24",
      "inputPerMillion": 0.2156,
      "outputPerMillion": 0.6468,
      "pricingSource": "openrouter",
      "costTier": "low",
      "equivalentTier": "T1-balanced",
      "capabilities": [
        "chat",
        "vision"
      ],
      "contextTokens": 1048576,
      "notes": "Auto-inserted by ModelCatalogSync 2026-08-24. Verify costTier/equivalentTier/capabilities and remove this note on first human review.",
      "discoveredVia": [
        "openrouter"
      ],
      "openrouterId": "deepseek/deepseek-v4-flash-vision-exp",
      "directApiName": null
    },
    {
      "name": "deepseek-v4-pro-0813",
      "displayName": "DeepSeek V4 Pro 0813",
      "status": "active",
      "addedAt": "2026-08-17",
      "inputPerMillion": 0.66,
      "outputPerMillion": 1.98,
      "pricingSource": "openrouter",
      "costTier": "medium",
      "equivalentTier": "T2-power",
      "capabilities": [
        "chat"
      ],
      "contextTokens": 1048576,
      "notes": "Auto-inserted by ModelCatalogSync 2026-08-17. Verify costTier/equivalentTier/capabilities and remove this note on first human review.",
      "discoveredVia": [
        "openrouter"
      ],
      "openrouterId": "deepseek/deepseek-v4-pro-0813",
      "directApiName": null
    },
    {
      "name": "deepseek-v4-flash-0731",
      "displayName": "DeepSeek V4 Flash 0731",
      "status": "active",
      "addedAt": "2026-08-10",
      "inputPerMillion": 0.15,
      "outputPerMillion": 0.15,
      "pricingSource": "openrouter",
      "costTier": "low",
      "equivalentTier": "T1-balanced",
      "capabilities": [
        "chat"
      ],
      "contextTokens": 1048576,
      "notes": "Auto-inserted by ModelCatalogSync 2026-08-10. Verify costTier/equivalentTier/capabilities and remove this note on first human review.",
      "discoveredVia": [
        "openrouter"
      ],
      "openrouterId": "deepseek/deepseek-v4-flash-0731",
      "directApiName": null
    },
    {
      "name": "deepseek-v4-pro",
      "displayName": "DeepSeek V4 Pro",
      "status": "active",
      "addedAt": "2026-05-14",
      "inputPerMillion": 0.9553,
      "outputPerMillion": 1.9105,
      "pricingSource": "openrouter",
      "costTier": "low",
      "equivalentTier": "T2-power",
      "capabilities": [
        "chat"
      ],
      "contextTokens": 1048576,
      "notes": "Auto-inserted by ModelCatalogSync 2026-05-14. Verify costTier/equivalentTier/capabilities and remove this note on first human review.",
      "discoveredVia": [
        "openrouter"
      ],
      "openrouterId": "deepseek/deepseek-v4-pro",
      "directApiName": null
    },
    {
      "name": "deepseek-v4-flash",
      "displayName": "DeepSeek V4 Flash",
      "status": "active",
      "addedAt": "2026-05-14",
      "inputPerMillion": 0.091,
      "outputPerMillion": 0.182,
      "pricingSource": "openrouter",
      "costTier": "low",
      "equivalentTier": "T1-balanced",
      "capabilities": [
        "chat"
      ],
      "contextTokens": 1048576,
      "notes": "Auto-inserted by ModelCatalogSync 2026-05-14. Verify costTier/equivalentTier/capabilities and remove this note on first human review.",
      "discoveredVia": [
        "openrouter"
      ],
      "openrouterId": "deepseek/deepseek-v4-flash",
      "directApiName": null
    },
    {
      "name": "deepseek-v3.2",
      "displayName": "DeepSeek V3.2",
      "status": "active",
      "addedAt": "2026-05-14",
      "inputPerMillion": 0.28,
      "outputPerMillion": 0.42,
      "pricingSource": "openrouter",
      "costTier": "low",
      "equivalentTier": "T1-balanced",
      "capabilities": [
        "chat"
      ],
      "contextTokens": 163840,
      "notes": "Auto-inserted by ModelCatalogSync 2026-05-14. Verify costTier/equivalentTier/capabilities and remove this note on first human review.",
      "discoveredVia": [
        "openrouter"
      ],
      "openrouterId": "deepseek/deepseek-v3.2",
      "directApiName": null
    },
    {
      "name": "deepseek-v3.2-exp",
      "displayName": "DeepSeek V3.2 Exp",
      "status": "active",
      "addedAt": "2026-05-14",
      "inputPerMillion": 0.27,
      "outputPerMillion": 0.41,
      "pricingSource": "openrouter",
      "costTier": "low",
      "equivalentTier": "T1-balanced",
      "capabilities": [
        "chat"
      ],
      "contextTokens": 163840,
      "notes": "Auto-inserted by ModelCatalogSync 2026-05-14. Verify costTier/equivalentTier/capabilities and remove this note on first human review.",
      "discoveredVia": [
        "openrouter"
      ],
      "openrouterId": "deepseek/deepseek-v3.2-exp",
      "directApiName": null
    },
    {
      "name": "deepseek-v3.1-terminus",
      "displayName": "DeepSeek V3.1 Terminus",
      "status": "active",
      "addedAt": "2026-05-14",
      "inputPerMillion": 0.27,
      "outputPerMillion": 1,
      "pricingSource": "openrouter",
      "costTier": "low",
      "equivalentTier": "T1-balanced",
      "capabilities": [
        "chat"
      ],
      "contextTokens": 163840,
      "notes": "Auto-inserted by ModelCatalogSync 2026-05-14. Verify costTier/equivalentTier/capabilities and remove this note on first human review.",
      "discoveredVia": [
        "openrouter"
      ],
      "openrouterId": "deepseek/deepseek-v3.1-terminus",
      "directApiName": null
    },
    {
      "name": "deepseek-chat-v3.1",
      "displayName": "DeepSeek V3.1",
      "status": "active",
      "addedAt": "2026-05-14",
      "inputPerMillion": 0.25,
      "outputPerMillion": 0.95,
      "pricingSource": "openrouter",
      "costTier": "low",
      "equivalentTier": "T1-balanced",
      "capabilities": [
        "chat"
      ],
      "contextTokens": 163840,
      "notes": "Auto-inserted by ModelCatalogSync 2026-05-14. Verify costTier/equivalentTier/capabilities and remove this note on first human review.",
      "discoveredVia": [
        "openrouter"
      ],
      "openrouterId": "deepseek/deepseek-chat-v3.1",
      "directApiName": null
    },
    {
      "name": "deepseek-r1-0528",
      "displayName": "R1 0528",
      "status": "active",
      "addedAt": "2026-05-14",
      "inputPerMillion": 0.5,
      "outputPerMillion": 2.15,
      "pricingSource": "openrouter",
      "costTier": "medium",
      "equivalentTier": "T1-balanced",
      "capabilities": [
        "chat"
      ],
      "contextTokens": 163840,
      "notes": "Auto-inserted by ModelCatalogSync 2026-05-14. Verify costTier/equivalentTier/capabilities and remove this note on first human review.",
      "discoveredVia": [
        "openrouter"
      ],
      "openrouterId": "deepseek/deepseek-r1-0528",
      "directApiName": null
    },
    {
      "name": "deepseek-chat-v3-0324",
      "displayName": "DeepSeek V3 0324",
      "status": "active",
      "addedAt": "2026-05-14",
      "inputPerMillion": 0.29,
      "outputPerMillion": 1.14,
      "pricingSource": "openrouter",
      "costTier": "low",
      "equivalentTier": "T1-balanced",
      "capabilities": [
        "chat"
      ],
      "contextTokens": 163840,
      "notes": "Auto-inserted by ModelCatalogSync 2026-05-14. Verify costTier/equivalentTier/capabilities and remove this note on first human review.",
      "discoveredVia": [
        "openrouter"
      ],
      "openrouterId": "deepseek/deepseek-chat-v3-0324",
      "directApiName": null
    },
    {
      "name": "deepseek-r1",